<?xml version="1.0"?>
<lpd_command_sequence name="AutoResets_ShortExposures_AsicControl.xml"
	xmlns:xsi="http://www.w3.org/2001/XMLSchema-instance"
	xsi:noNamespaceSchemaLocation="lpdCommandSequence.xsd">

    <!-- For Pseudo random data from asic  jac 
         asic simply starts outputting pseudorandom data as soon as test_mode_d received
         Nb must not send start readout to asic or messes up subsequent runs
         so must relay on a fixed delay for asicrx start strobe
		 therefore changing the relative start position of test_mode_d will change the timing of capture
         cmds copied from fast_random_gaps.txt
     -->

	<nop/>
	<sync_reset/>
	<nop/>
	<!--reset_state_machine/>
	<nop/>
	<asic_slow_readout_start/
	<nop/>
	<sync_reset/>
	<nop/>
	<read_out_data/-->
	<nop/>
	<test_mode_d/>
	<nop/>
	<nop/>
	<!-- Add enough nops to allow all data to be clocked out of the ASICs before <reset_state_machine/> 
        840 NOPs per image (512 pixels x 3 x 12 bits) -->
	<loop count="4">
		<nop/>
		<nop count="838"/>
	</loop>
	<!--stop_read_out/-->
	<reset_state_machine/>

</lpd_command_sequence>
	
