<?xml version="1.0"?>
<lpd_command_sequence name="Command_LongExposure_what.xml"
	xmlns:xsi="http://www.w3.org/2001/XMLSchema-instance"
	xsi:noNamespaceSchemaLocation="lpdCommandSequence.xsd">

    <!-- Rules for lpd command sequence  jac 

        There MUST be a single <nop/> immediately before <sync_reset/>, <read_out_data/> and <asic_slow_readout_start/> 
        There MUST be exactly 1 <nop/> between <sync_reset/> and <read_out_data/> 

        For readout add enough <nop/>s to ensure all data is clocked out of the ASICs before <reset_state_machine/> 
        840 <nop/>s per image (512 pixels x 3 x 12 bits) plus allow extra 1000 <nop/>s for offset from readout cmd to start of asic header

        If reading out V1 ASIC need  <asic_slow_readout_start/> in cmd sequence to slow clock during readout phase
        Must also set femAsicSlowedClock parameter in LpdReadoutTest.py to TRUE
    -->

	<nop/>
	<sync_reset/>
	<nop/>
	<reset_state_machine/>
	<nop/>
	<sync_reset/>
	<nop/>
	<on_chip_reset_disable/>
	<nop/>
	<reset_write_pointer/>
	<reset_trigger_pointer/>
	<clear_skip_register/>
	<nop/>
	<reset_pre_amp/>
	<reset_gain_front/>
	<reset_gain_back/>
	<start_write_pointer/>
	<remove_reset_pre_amp/>
	<remove_reset_gain_stage1/>
	<remove_reset_gain_stage2/>
	<start_trigger_pointer/> 
	<nop count="4"/>
	<trigger_flag_set/>
	<nop count="9"/>
	<trigger_flag_set/>
	<nop count="9"/>
	<trigger_flag_set/>
	<nop count="9"/>
	<trigger_flag_set/>
	<nop count="2"/>
	<reset_pre_amp/>
	<reset_gain_front/>
	<reset_gain_back/>
	<reset_write_pointer/>
	<reset_trigger_pointer/>
	<nop/>
	<asic_slow_readout_start/>
	<nop/>
	<sync_reset/>
	<nop/>
	<read_out_data/>
	<loop count="6">
		<nop count="840"/>
	</loop>
	<nop count="1000"/>
	<stop_read_out/>
	<nop count="33"/>
	
	<!-- Matt's command sequence configuration:
	Command Sequence
	Manual Resets â€“ Long Exposure
	Part 1 (100MHz)
	Sync Reset
	NOP
	Reset SM
	Sync Reset
	NOP
	On chip rst dis
	NOP
	Rst write ptr
	Rst trig ptr
	Clr skip reg
	NOP
	Rst preamp
	Rst gain front
	Rst gain back
	Rem rst preamp
	Rem rst gain st1
	Rem rst gain st2
	Start trig ptr
	NOPx4
	Trig flag set
	NOPx9
	Trig flag set
	NOPx9
	Trig flag set
	NOPx9
	Trig flag set
	NOPx2
	Rst preamp
	Rst gain front
	Rst gain back
	Rst write ptr
	Rst trig ptr
	NOP
	Asic slow readout
	Part 2 (6MHz)
	NOP
	Sync reset
	NOP
	Read out data
	NOP x 3500
	Stop read out
	NOP x 33
	-->
</lpd_command_sequence>
	