<?xml version="1.0"?>
<lpd_command_sequence name="Command_LongExposure_V2.xml"
	xmlns:xsi="http://www.w3.org/2001/XMLSchema-instance"
	xsi:noNamespaceSchemaLocation="lpdCommandSequence.xsd">

    <!-- Rules for lpd command sequence  jac 

        There MUST be a single <nop/> immediately before <sync_reset/>, <read_out_data/> and <asic_slow_readout_start/> 
        There MUST be exactly 1 <nop/> between <sync_reset/> and <read_out_data/> 

        For readout add enough nops to ensure all data is clocked out of the ASICs before <reset_state_machine/> 
        840 NOPs per image (512 pixels x 3 x 12 bits) plus a few extra

        If reading out V1 ASIC need  <asic_slow_readout_start/> in cmd sequence to slow clock during readout phase
        Must also set femAsicSlowedClock parameter in LpdReadoutTest.py to TRUE

		for asic v2 so no slow clock for readout

    -->

	<nop/>
	<sync_reset/>
	<nop/>
	<reset_state_machine/>
	<nop/>
	<sync_reset/>
	<nop/>
	<on_chip_reset_disable/>
	<nop/>
	<reset_write_pointer/>
	<reset_trigger_pointer/>
	<clear_skip_register/>
	<nop/>
	<reset_pre_amp/>
	<reset_gain_front/>
	<reset_gain_back/>
	<start_write_pointer/>
	<remove_reset_pre_amp/>
	<remove_reset_gain_stage1/>
	<remove_reset_gain_stage2/>
	<start_trigger_pointer/> 
	<nop count="30"/>
	<trigger_flag_set/>
	<nop count="10"/>
	<trigger_flag_set/>
	<nop count="10"/>
	<trigger_flag_set/>
	<nop count="10"/>
	<trigger_flag_set/>
	<nop count="2"/>
	<reset_pre_amp/>
	<reset_gain_front/>
	<reset_gain_back/>
	<reset_write_pointer/>
	<reset_trigger_pointer/>
	<nop/>
	<nop/>
	<nop/>
	<sync_reset/>
	<nop/>
	<read_out_data/>
	<!-- Add enough nops to allow all data to be clocked out of the ASICs before <reset_state_machine/> 
        840 NOPs per image (512 pixels x 3 x 12 bits) -->
	<loop count="4">
		<nop/>
		<nop count="838"/>
	</loop>
    <nop count="30"/>   # one extra row
	<stop_read_out/>
	<nop count="33"/>
</lpd_command_sequence>
	
