<?xml version="1.0"?>
<lpd_command_sequence name="longExposure_all_3gains_asicv2_A.xml"
	xmlns:xsi="http://www.w3.org/2001/XMLSchema-instance"
	xsi:noNamespaceSchemaLocation="lpdCommandSequence.xsd">

    <!-- Rules for lpd command sequence  jac 

        File for reading out ALL 3 gains.
        One usual cycle of long exposure triggers then readout is repeated 3 times, once for each gain.
        Uses new dummy Fast commands to switch gain select and controlling asic rx logic.
        This overrides gain selection from register.
    
        There MUST be a single <nop/> immediately before <sync_reset/>, <read_out_data/> , <stop_read_out/> and <asic_slow_readout_start/> 
        There MUST be exactly 1 <nop/> between <sync_reset/> and <read_out_data/> 

        For readout add enough nops to ensure all data is clocked out of the ASICs before <reset_state_machine/> 
        836 NOPs per image (512 pixels x 3 x 12 bits) plus a few extra

        If reading out V1 ASIC need  <asic_slow_readout_start/> in cmd sequence to slow clock during readout phase
        Must also set femAsicSlowedClock parameter in LpdReadoutTest.py to TRUE

		for asic v2 so no slow clock for readout

    -->

	<nop/>  
	<sync_reset/>   <!-- need a single nop before this command -->
	<nop/>
	<reset_state_machine/>   <!-- need a single nop before this command -->
	<nop/>  
	<sync_reset/>
	<nop/>
	<on_chip_reset_disable/>  <!-- manual resets for long exposures -->
	<nop/>
	<reset_write_pointer/>
	<reset_trigger_pointer/>
	<clear_skip_register/>
	<nop/>
	<reset_pre_amp/>
	<reset_gain_front/>
	<reset_gain_back/>
	<start_write_pointer/>
	<remove_reset_pre_amp/>
	<remove_reset_gain_stage1/>
	<remove_reset_gain_stage2/>
	<start_trigger_pointer/> 
	<nop count="20"/>
	<trigger_flag_set/>
	<nop count="2"/>
	<reset_pre_amp/>
	<reset_gain_front/>
	<reset_gain_back/>
	<reset_write_pointer/>
	<reset_trigger_pointer/>
	<nop/>
	<nop/>

<!-- 
     Readout Sequences with differnet Gain Selections
-->

	<nop/>    
	<force_gain_x100/>   <!-- need a single nop before this command -->
	<nop/>  
	<sync_reset/>   <!-- need a single nop before this command -->
	<nop/>  
	<read_out_data/>   <!-- need a single nop before this command -->

<!-- must allow for latency before 1st image only  -->
  <nop count="35"/>  <!-- Fixed Latency before start of asic data arriving at FEM -->  

<!-- now readout multiple images  -->

	<loop count="1">     <!-- 1 loop per image to readout -->
		<nop count="836"/>
	</loop>
<!-- 
     
-->
	<nop/>    
	<force_gain_x10/>    <!-- need a single nop before this command -->
	<loop count="1">  <!-- 1 loop per image to readout -->
		<nop count="836"/>
	</loop>
<!-- 
     
-->
	<nop/>    
	<force_gain_x1/>    <!-- need a single nop before this command -->
	<loop count="1">  <!-- 1 loop per image to readout -->
		<nop count="836"/>
	</loop>
<!-- 
     
-->
	<nop/>   
	<force_gain_x100/>   <!-- need a single nop before this command -->
	<loop count="1">   <!-- 1 loop per image to readout -->
		<nop/>
		<nop count="836"/>
	</loop>
	<nop/>    
	<stop_read_out/>   <!-- need a single nop before this command -->
<!-- 
      End
-->
</lpd_command_sequence>	
