<?xml version="1.0"?>
<lpd_command_sequence name="SuperModuleNormalOperation.xml"
	xmlns:xsi="http://www.w3.org/2001/XMLSchema-instance"
	xsi:noNamespaceSchemaLocation="lpdCommandSequence.xsd">

	<sync_reset/> <!-- Start Config chip -->
	<nop/>
	<on_chip_reset_enable/>
	<nop/>
	<reset_write_pointer/>
	<reset_trigger_pointer/>
	<clear_skip_register/>
	<start_write_pointer/>
	<start_trigger_pointer/> 
	<nop/>
	<nop/>
	<trigger_flag_set count="4"/><!-- 4 images saved from ASICs -->
	<nop/>
	<on_chip_reset_disable/>
	<reset_pre_amp/>
	<reset_gain_front/>
	<reset_gain_back/>
	<reset_write_pointer/>
	<reset_trigger_pointer/>

	<nop count="4"/>
	<nop/>
	<asic_slow_readout_start/>
	<nop count="4"/>
	<nop/>
	<sync_reset/>
	<nop/>
	<read_out_data/> 
	<!-- Add additional NOPS to allow sufficient data to be clocked out of the ASICs -->
	<loop count="11">
		<nop/>
		<nop count="501"/>
	</loop>
	<nop/>
	<reset_state_machine/>
	<nop/>
</lpd_command_sequence>
